{
  "apiVersion": "loadtest.isi/v1alpha1",
  "kind": "WorkloadModel",
  "metadata": {
    "name": "crewai-deepseek-agent",
    "targetService": "crewai-deepseek-agent",
    "environment": "oat05854",
    "generatedAt": "2026-10-09T09:05:00Z",
    "source": {
      "tool": "dtctl",
      "timeframe": "2026-10-09T08:33Z/2026-10-09T09:01Z (active load window)",
      "timeframeNotes": "active load window (ramp-up -> plateau 12rpm -> ramp-down); single-service agent app, no noise classifier hits",
      "queries": [
        "fetch spans | filter is_root_span && service.name=='crewai-deepseek-agent' | sort start_time asc | summarize takeFirst(span.name) by trace.id | summarize count() by entryOp  (front-end discovery -> single entry request)",
        "fetch logs | filter k8s.container.name=='istio-proxy' | summarize count()  (access-log probe -> 0, spans-only)",
        "fetch spans | join [spans|sort start_time asc|summarize collectArray(span.name) by trace.id] on trace.id  (JOURNEY reconstruction: ReAct loop vs single LLM round)",
        "fetch spans | filter request && summarize countIf(span.name=='execute_tool') by trace.id | summarize count() by usesTool  (archetype split via AGENTIC_TOOL_PATTERNS)",
        "fetch spans | filter request | summarize percentile(duration,50/95/99),avg by usesTool  (per-archetype baseline)",
        "fetch spans | filter request | summarize count() by bin(start_time,1m)  (G3-B arrival curve + CoV 0.233 -> ramp)",
        "fetch spans | filter request | summarize sum(duration) over active window  (observed concurrency)"
      ],
      "evidenceSources": [
        "span"
      ],
      "accessLogAvailability": "unavailable",
      "samplingRatio": 1.0
    }
  },
  "spec": {
    "arrivalProfile": {
      "model": "open",
      "stages": [
        {
          "duration": "3m",
          "rate": 0.1389,
          "shape": "ramp_up"
        },
        {
          "duration": "1m",
          "rate": 0.2,
          "shape": "plateau"
        },
        {
          "duration": "24m",
          "rate": 0.1931,
          "shape": "ramp_down"
        }
      ],
      "littlesLawCheck": {
        "expectedConcurrency": 0.4262,
        "observedConcurrency": 0.411,
        "ratio": 1.0369
      }
    },
    "journeys": [
      {
        "id": "conversational",
        "description": "Conversational \u2014 pure-LLM turn (single round); no tool. Reconstructed internal flow: request -> agent.turn -> Crew Created -> Task Created -> llm.call -> chat -> finalize -> message.sent  (single LLM round)",
        "weight": 0.6799,
        "entrypoint": "crewai-deepseek-agent/request",
        "unlinked": true,
        "evidenceSource": "span",
        "steps": [
          {
            "id": "s1",
            "service": "crewai-deepseek-agent",
            "operation": "crewai-deepseek-agent/request",
            "callType": "http",
            "evidenceSource": "span",
            "payloadRef": "prompt_chat"
          }
        ],
        "baseline": {
          "p50Ms": 1235,
          "p95Ms": 1776,
          "p99Ms": 16350,
          "errorRate": 0.0
        }
      },
      {
        "id": "agentic",
        "description": "Agentic \u2014 tool-using turn (ReAct: LLM -> tool -> LLM); reaches execute_tool. Reconstructed internal flow: request -> agent.turn -> Crew Created -> Task Created -> llm.call -> chat -> execute_tool -> Tool Usage -> llm.call -> chat -> finalize -> message.sent  (ReAct loop: LLM -> tool -> LLM)",
        "weight": 0.3201,
        "entrypoint": "crewai-deepseek-agent/request",
        "unlinked": true,
        "evidenceSource": "span",
        "steps": [
          {
            "id": "s1",
            "service": "crewai-deepseek-agent",
            "operation": "crewai-deepseek-agent/request",
            "callType": "http",
            "evidenceSource": "span",
            "payloadRef": "prompt_agentic"
          }
        ],
        "baseline": {
          "p50Ms": 3338,
          "p95Ms": 6072,
          "p99Ms": 35061,
          "errorRate": 0.0
        }
      }
    ],
    "payloads": {
      "prompt_agentic": {
        "fields": [
          {
            "name": "task",
            "type": "string",
            "generator": "const",
            "values": [
              "search the web for the latest OTel release and summarize",
              "look up the current time in Tokyo and convert to UTC"
            ],
            "distribution": "uniform"
          }
        ],
        "seed": 42
      },
      "prompt_chat": {
        "fields": [
          {
            "name": "task",
            "type": "string",
            "generator": "const",
            "values": [
              "explain distributed tracing in one paragraph",
              "what is Little's Law"
            ],
            "distribution": "uniform"
          }
        ],
        "seed": 42
      }
    },
    "caps": {
      "maxRps": 2,
      "maxVus": 20,
      "maxDuration": "30m"
    },
    "coverage": 1.0
  },
  "status": {
    "revision": 1,
    "hash": "sha256:5ab79610043d454dde240f0d21997809553b439621a57da7ee0007e41a5ed1b4"
  }
}
