{
  "apiVersion": "loadtest.isi/v1alpha1",
  "kind": "WorkloadModel",
  "metadata": {
    "name": "otel-astronomy-frontend",
    "targetService": "frontend-proxy",
    "environment": "oat05854",
    "generatedAt": "2026-10-09T00:00:00Z",
    "source": {
      "tool": "dtctl",
      "timeframe": "-3h (2026-10-09, deploy-free/incident-free window)",
      "timeframeNotes": "deploy-free/incident-free 3h window; noise classifier dropped health/metrics (memos, honcho), flagd polling, and Kafka consumers",
      "queries": [
        "fetch spans | filter request.is_root_span==true | sort start_time asc | summarize takeFirst(service.name),takeFirst(span.name) by trace.id | summarize count() by entryService,entryOp  (G1-C front-end discovery)",
        "fetch logs | filter k8s.container.name=='istio-proxy' | summarize count()  (access-log availability probe -> 0)",
        "fetch spans | filter is_root_span && service.name=='load-generator' && startsWith(span.name,'user_') | summarize count() by entryOp  (G3-A pace)",
        "fetch spans ... join collectDistinct(service.name) by trace.id ... summarize avg(nsvc),takeAny(services) by entryOp  (G1-E reach/svcSet)",
        "fetch spans | filter span.kind=='server' && service.name=='frontend' | summarize percentile(duration,50/95/99),avg(duration) by span.name  (route baselines)",
        "fetch spans | filter is_root_span && service.name=='load-generator' && startsWith(span.name,'user_') | summarize count() by bin(start_time,1m) | summarize avg,stddev  (G3-B CoV)",
        "fetch spans | filter span.kind=='server' && service.name=='frontend' | summarize sum(duration)/window  (observed concurrency)",
        "fetch spans | filter service.name=='product-catalog' && isNotNull(app.product.id) | summarize countDistinctExact(app.product.id),count()  (G4 cache keyCardinality)"
      ],
      "evidenceSources": [
        "span"
      ],
      "accessLogAvailability": "unavailable",
      "samplingRatio": 1.0
    }
  },
  "spec": {
    "arrivalProfile": {
      "model": "open",
      "stages": [
        {
          "duration": "179m",
          "rate": 0.7365,
          "shape": "steady"
        },
        {
          "duration": "2m",
          "rate": 0.0,
          "shape": "ramp_down"
        }
      ],
      "littlesLawCheck": {
        "expectedConcurrency": 3.705,
        "observedConcurrency": 3.7,
        "ratio": 1.0014
      }
    },
    "journeys": [
      {
        "id": "browse-product-page",
        "description": "Browse product page \u2014 merged from user_browse_product, user_get_ads, user_get_product_reviews, user_ask_product_ai_assistant (reach 4)",
        "weight": 0.521,
        "entrypoint": "GET /api/products/[productId]/index",
        "codeRef": "src/frontend/pages/api/products/[productId].ts#handler",
        "evidenceSource": "span",
        "spanless": false,
        "steps": [
          {
            "id": "s1",
            "service": "frontend",
            "operation": "GET /api/products/[productId]/index",
            "callType": "http",
            "codeRef": "src/frontend/pages/api/products/[productId].ts#handler",
            "evidenceSource": "span",
            "payloadRef": "product"
          }
        ],
        "baseline": {
          "p50Ms": 2,
          "p95Ms": 16,
          "p99Ms": 46,
          "errorRate": 0.0
        }
      },
      {
        "id": "cart",
        "description": "Cart \u2014 merged from user_add_to_cart, user_view_cart (reach 5)",
        "weight": 0.2861,
        "entrypoint": "POST /api/cart",
        "codeRef": "src/frontend/pages/api/cart.ts#handler",
        "evidenceSource": "span",
        "spanless": false,
        "steps": [
          {
            "id": "s1",
            "service": "frontend",
            "operation": "POST /api/cart",
            "callType": "http",
            "codeRef": "src/frontend/pages/api/cart.ts#handler",
            "evidenceSource": "span"
          }
        ],
        "baseline": {
          "p50Ms": 3,
          "p95Ms": 5,
          "p99Ms": 7,
          "errorRate": 0.0
        }
      },
      {
        "id": "recommendations",
        "description": "Recommendations \u2014 merged from user_get_recommendations (reach 5)",
        "weight": 0.0968,
        "entrypoint": "GET /api/recommendations",
        "codeRef": "src/frontend/pages/api/recommendations.ts#handler",
        "evidenceSource": "span",
        "spanless": false,
        "steps": [
          {
            "id": "s1",
            "service": "frontend",
            "operation": "GET /api/recommendations",
            "callType": "http",
            "codeRef": "src/frontend/pages/api/recommendations.ts#handler",
            "evidenceSource": "span"
          }
        ],
        "baseline": {
          "p50Ms": 12,
          "p95Ms": 15,
          "p99Ms": 20,
          "errorRate": 0.0
        }
      },
      {
        "id": "checkout",
        "description": "Checkout \u2014 merged from user_checkout_single, user_checkout_multi (reach 12)",
        "weight": 0.0665,
        "entrypoint": "POST /api/checkout",
        "codeRef": "src/frontend/pages/api/checkout.ts#handler",
        "evidenceSource": "span",
        "spanless": false,
        "steps": [
          {
            "id": "s1",
            "service": "frontend",
            "operation": "POST /api/cart",
            "callType": "http",
            "codeRef": "src/frontend/pages/api/cart.ts#handler",
            "evidenceSource": "span"
          },
          {
            "id": "s2",
            "service": "frontend",
            "operation": "POST /api/checkout",
            "callType": "http",
            "codeRef": "src/frontend/pages/api/checkout.ts#handler",
            "evidenceSource": "span",
            "payloadRef": "checkout",
            "dependsOn": [
              "s1"
            ],
            "correlates": [
              {
                "sourceStepId": "s1",
                "extract": {
                  "from": "header",
                  "path": "set-cookie:session"
                },
                "inject": {
                  "into": "header",
                  "as": "cookie"
                }
              }
            ]
          }
        ],
        "baseline": {
          "p50Ms": 53188,
          "p95Ms": 106377,
          "p99Ms": 150441,
          "errorRate": 0.0
        }
      },
      {
        "id": "home",
        "description": "Home \u2014 merged from user_index (reach 3)",
        "weight": 0.0295,
        "entrypoint": "GET /",
        "codeRef": "src/frontend/pages/index.tsx#Home",
        "evidenceSource": "span",
        "spanless": false,
        "steps": [
          {
            "id": "s1",
            "service": "frontend",
            "operation": "GET /",
            "callType": "http",
            "codeRef": "src/frontend/pages/index.tsx#Home",
            "evidenceSource": "span"
          }
        ],
        "baseline": {
          "p50Ms": 4,
          "p95Ms": 5,
          "p99Ms": 6,
          "errorRate": 0.0
        }
      }
    ],
    "payloads": {
      "product": {
        "fields": [
          {
            "name": "productId",
            "type": "enum",
            "generator": "const",
            "values": [
              "2ZYFJ3GM2N",
              "66VCHSJNUP",
              "6E92ZMYYFZ",
              "0PUK6V6EV0",
              "9SIQT8TOJO",
              "HQTGWGPNH4",
              "L9ECAV7KIM",
              "1YMWWN1N4O",
              "OLJCESPC7Z",
              "LS4PSXUNUM"
            ],
            "distribution": "zipf"
          }
        ],
        "seed": 42,
        "cacheProfile": {
          "targetHitRatio": 0.99,
          "keyCardinality": 10,
          "distributionAlpha": 0.1,
          "backingStoreSeeded": true
        }
      },
      "checkout": {
        "fields": [
          {
            "name": "email",
            "type": "string",
            "generator": "faker:email"
          },
          {
            "name": "creditCardNumber",
            "type": "string",
            "generator": "faker:ccNumber"
          },
          {
            "name": "currencyCode",
            "type": "enum",
            "generator": "const",
            "values": [
              "USD",
              "EUR",
              "GBP",
              "JPY"
            ],
            "distribution": "weighted"
          }
        ],
        "seed": 42
      }
    },
    "caps": {
      "maxRps": 5,
      "maxVus": 50,
      "maxDuration": "45m"
    },
    "coverage": 1.0
  },
  "status": {
    "revision": 1,
    "hash": "sha256:2d941725c00ad4fcc04030f12278a2df806033f3c5c910b3009a97825bb33a14"
  }
}
